game_name,place_in_top,genres,release_date,rated_age_letter,age_restriction,avg_playtime,platforms,developers,publisher,other_games_in_series,tags,metascore_rating,place_in_that_year,place_in_rawq_by_genre,genre_of_this_place,game_link,website
The Beatles: Rock Band,476,Arcade,"Sep 9, 2009",Rated T,13,4.0,"Wii, Xbox 360, PlayStation 3","Electronic Arts, Harmonix Music Systems, MTV Games","Electronic Arts, MTV Games",No,"Music, Rhythm",89,127,277,Arcade,https://rawg.io/games/the-beatles-rock-band,http://www.thebeatlesrockband.com/
Advance Wars 2: Black Hole Rising,477,Strategy,"Jun 24, 2003",Rated E,0,3.0,"Wii U, Game Boy Advance",Intelligent Systems,Nintendo,"Advance Wars 1+2: Re-Boot Camp, Advance Wars: Days of Ruin, Advance Wars: Dual Strike, Advance Wars, Super Famicom Wars, Game Boy Wars, Famicom Wars","Singleplayer, Multiplayer",89,134,3005,Strategy,https://rawg.io/games/advance-wars-2-black-hole-rising,Not defined
Return of the Obra Dinn,478,"Adventure, Indie","Oct 18, 2018",Not rated,17,5.0,"Nintendo Switch, PlayStation 4, Xbox One, PC, macOS","3909, Lucas Pope, dukope",3909,No,"Singleplayer, Steam Achievements, Full controller support, Horror, Gore, Violent, Mystery, Detective, Pirates, Time Manipulation, ship, 1-bit, mac-plus, dinn, obra",89,51,217,Indie,https://rawg.io/games/return-of-the-obra-dinn,https://obradinn.com
Lumines,479,Casual,"Mar 22, 2005",Rated E10+,0,1.0,"PSP, PC",Q Entertainment,Q Entertainment,"Lumines Remastered, Lumines Electronic Symphony, Lumines II, LUMINES LIVE!, LUMINES Supernova, Lumines: Puzzle Fusion","Singleplayer, Music",89,269,2998,Casual,https://rawg.io/games/lumines,Not defined
L.A. Noire,480,"Action, Adventure","May 17, 2011",Rated M,17,7.0,"PlayStation 4, PlayStation 3, Xbox 360, PC, Xbox One, Nintendo Switch",Team Bondi,Rockstar Games,No,"Singleplayer, Atmospheric, RPG, Story Rich, Open World, Third Person, Partial Controller Support, Third-Person Shooter, Nudity, Mystery, Mature, Cinematic, Crime, 3D Vision, Detective, Noir, Investigation",89,5,12,Adventure,https://rawg.io/games/l-a-noire,https://www.rockstargames.com/lanoire/
Peggle,482,"Arcade, Puzzle","Mar 11, 2009",Rated E,0,2.0,"Xbox 360, PlayStation 3, PC",PopCap Games,PopCap Games,"Peggle Blast, Peggle 2, Peggle Nights, Peggle Extreme","friends, memory, ball",89,56,192,Arcade,https://rawg.io/games/peggle,http://www.popcap.com/games/peggle
New Super Mario Bros.,485,"Action, Arcade, Platformer","May 15, 2006",Rated E,0,25.0,"Wii U, Nintendo DS",Nintendo,Nintendo,"Super Mario Odyssey, Super Mario Run, Super Mario 3D World, New Super Mario Bros. U, New Super Mario Bros. 2, Super Mario 3D Land, Super Mario Galaxy 2, New Super Mario Bros. Wii, Super Mario Galaxy, Super Mario Sunshine, Super Mario World: Super Mario Advance 2, Super Mario 64, Super Mario World 2: Yoshi's Island, Super Mario Land 2: 6 Golden Coins, Super Mario World, Super Mario Land, Super Mario Bros. 3, Super Mario Bros. 2, Super Mario Bros.","console, Minigames, NES, princess, mario, blue",89,61,248,Platformer,https://rawg.io/games/new-super-mario-bros,http://newsupermariobrosds.nintendo.com/
Castlevania Dominus Collection,487,"Action, RPG","Aug 27, 2024",Rated T,0,29.0,PC,Konami Digital Entertainment,Konami,No,"Singleplayer, Steam Achievements, Full controller support, RPG, 2D, Horror, Exploration, Classic, Violent, Action-Adventure, Action RPG, Pixel Graphics, Controller, Retro, Dark Fantasy, Magic, Metroidvania, Demons, 2D Platformer, 2D-платформер, Family Sharing, Vampire",89,402,6435,RPG,https://rawg.io/games/castlevania-dominus-collection,Not defined
Metal Gear Solid: Peace Walker,488,"Action, Adventure","Jun 8, 2010",Rated T,13,211.0,"PS Vita, PSP, PlayStation 3, Xbox 360",Kojima Productions,Konami,"Metal Gear Survive, Metal Gear Solid V: The Phantom Pain, Metal Gear Rising: Revengeance, Metal Gear Solid 4: Guns of the Patriots, Metal Gear Solid: Portable Ops, Metal Gear Acid 2, Metal Gear Acid, Metal Gear Solid 3: Snake Eater, Metal Gear Solid 2: Substance, Metal Gear Solid 2: Sons of Liberty, Metal Gear: Ghost Babel, Metal Gear Solid, Metal Gear 2: Solid Snake, Metal Gear","Stealth, online, boss, metal, snake",89,195,1970,Adventure,https://rawg.io/games/metal-gear-solid-peace-walker,http://www.konami.com/games/metalgear/metalgearsolid-peace-walker.php
"WarioWare, Inc.: Mega Microgame$!",489,"Action, Casual","May 26, 2003",Rated E,0,10.4,Game Boy Advance,Nintendo,Nintendo,"WarioWare: Get It Together!, WarioWare Gold, WarioWare: D.I.Y. Showcase, WarioWare: D.I.Y., WarioWare: Snapped!, WarioWare: Smooth Moves, WarioWare: Touched!, WarioWare: Twisted!, WarioWare, Inc.: Mega Party Games!","Singleplayer, Multiplayer, console, quick, NES, business, crazy",89,116,2888,Casual,https://rawg.io/games/warioware-inc-mega-microgame,Not defined
Grandia,490,RPG,"Sep 30, 1999",Rated E,10,2.0,"SEGA Saturn, PlayStation, PC",GAME ARTS,"Ubisoft Entertainment, Sony Computer Entertainment, ESP Software","Grandia Online, GRANDIA III, Grandia Xtreme, Grandia: Parallel Trippers, Grandia II, Grandia Digital Museum","RPG, Mystery, Magic, battle, Epic",89,59,2572,RPG,https://rawg.io/games/grandia,Not defined
NBA 2K2,491,Sports,"Jan 12, 2002",Rated E,0,10.4,"PlayStation 2, Xbox, GameCube, Dreamcast",Visual Concepts,SEGA,No,"Basketball, beach",89,372,2026,Sports,https://rawg.io/games/nba-2k2,Not defined
Colors! 3D,492,Not defined,"Apr 5, 2012",Rated E,0,10.4,Nintendo 3DS,Not defined,Collecting Smiles,No,"exclusive, true exclusive, edutainment",89,8249,32065,Not in a rating,https://rawg.io/games/colors-3d,http://www.colors-3d.com
NBA 2K11,493,Sports,"Oct 5, 2010",Rated E,0,30.0,"Wii, PlayStation 3, PC, PlayStation 2",Visual Concepts,2K Sports,"NBA 2K23, NBA 2K22, NBA 2K21, NBA 2K20, NBA 2K19, NBA 2K18, NBA 2K17, NBA 2K16, NBA 2K15, NBA 2K14, NBA 2K13, NBA 2K12, NBA 2K10, NBA 2K9, NBA 2K8, NBA 2K7, NBA 2K6","online, challenge, collect",89,308,462,Sports,https://rawg.io/games/nba-2k11,http://www.facebook.com/NBA2K
Disco Elysium: The Final Cut,494,"Adventure, RPG","Mar 30, 2021",Rated M,0,5.0,"PlayStation 5, Xbox Series S/X, PlayStation 4, macOS, PC, iOS, Nintendo Switch, Xbox One",ZA/UM,Not defined,No,"exclusive, Detective, city, console, offline, hero, unique, block, disco",89,25,337,RPG,https://rawg.io/games/disco-elysium-the-final-cut,https://discoelysium.com/
Horizon Zero Dawn,495,"Action, RPG","Feb 28, 2017",Rated T,13,11.0,"PC, PlayStation 4",Guerrilla Games,Sony Computer Entertainment,"Lego Horizon Adventures, Horizon Call of the Mountain, Horizon Forbidden West","Singleplayer, Atmospheric, Great Soundtrack, RPG, Story Rich, Open World, Third Person, Sci-fi, Exploration, Female Protagonist, Stealth, Action RPG, role-playing, exclusive, Post-apocalyptic, Cinematic, Futuristic, Robots, 3rd-Person Perspective, Drama, Lore-Rich, 3rd-person, Experience, open-world, atmosphere",89,2,7,RPG,https://rawg.io/games/horizon-zero-dawn,https://www.guerrilla-games.com/play/horizon
Stardew Valley,496,"RPG, Simulation, Indie","Feb 26, 2016",Rated E10+,10,12.0,"Nintendo Switch, Xbox One, PC, iOS, macOS, Linux, PlayStation 4, PS Vita, Android","Chucklefish, ConcernedApe","Chucklefish, ConcernedApe",No,"Singleplayer, Steam Achievements, Multiplayer, Steam Cloud, Atmospheric, steam-trading-cards, Great Soundtrack, RPG, Co-op, Open World, 2D, Partial Controller Support, Sandbox, Pixel Graphics, Retro, role-playing, Cute, Crafting, Building, overlay, Relaxing, Dating Sim, Shared/Split Screen Co-op, cloud saves, Fishing, Agriculture, co-op multiplayer",89,6,2,Simulation,https://rawg.io/games/stardew-valley,http://www.stardewvalley.net
Devil May Cry 5: Special Edition,497,"Action, Adventure","Nov 12, 2020",Rated M,17,10.4,"Xbox Series S/X, PlayStation 5",Capcom U.S.A,Capcom,No,Not defined,89,474,3906,Adventure,https://rawg.io/games/devil-may-cry-5-special-edition,https://www.devilmaycry.com/5se/us/
The Last of Us Part I,498,"Action, Shooter, Adventure","Sep 2, 2022",Rated M,17,14.0,"PC, PlayStation 5",Naughty Dog,"Sony Computer Entertainment, PlayStation PC",No,"Singleplayer, Steam Achievements, Multiplayer, Full controller support, Steam Cloud, Atmospheric, Great Soundtrack, Story Rich, Third Person, Horror, Gore, Violent, Action-Adventure, Third-Person Shooter, Zombies, Survival Horror, Post-apocalyptic, Realistic, Cinematic, Remake, Drama, Emotional, Remote Play on TV, Постапокалипсис, Ремейк",89,31,356,Shooter,https://rawg.io/games/the-last-of-us-part-i,https://www.playstation.com/en-us/the-last-of-us/
Railroad Tycoon II,499,Strategy,"Nov 2, 1998",Rated E,0,10.4,"PC, Linux, PlayStation, Classic Macintosh, Dreamcast",PopTop Software,"Take Two Interactive, Gathering of Developers",No,"Singleplayer, Multiplayer",89,109,3772,Strategy,https://rawg.io/games/railroad-tycoon-ii,Not defined
ESPN NBA Basketball,500,Sports,"Oct 21, 2003",Rated E,0,10.4,"PlayStation 2, Xbox",Visual Concepts,SEGA,No,Not defined,89,744,3081,Sports,https://rawg.io/games/espn-nba-basketball,Not defined
Soul Edge,501,"Action, Fighting","Jan 31, 1997",Rated T,13,10.4,PlayStation,NAMCO,Namco,"SOUL CALIBUR, SoulCalibur VI, SoulCalibur: Lost Swords, SOULCALIBUR II HD, Soulcalibur V, Soul Calibur V, Soulcalibur: Broken Destiny, Soul Calibur IV, Soulcalibur Legends, Soul Calibur III, Soul Calibur II, Soulcalibur, SoulCalibur III: Arcade Edition",2 players,89,87,322,Fighting,https://rawg.io/games/soul-edge,Not defined
NBA Street,502,Sports,"Jun 18, 2001",Rated E,0,10.4,"GameCube, PlayStation 2","Electronic Arts Canada, NuFX",EA Sports BIG,No,"Singleplayer, Multiplayer",89,251,1458,Sports,https://rawg.io/games/nba-street,Not defined
Top Spin,503,Sports,"Oct 28, 2003",Rated E,0,10.4,PC,"Indie Built, Power and Magic Development",Atari,No,Not defined,89,427,2059,Sports,https://rawg.io/games/top-spin,http://perso.wanadoo.fr/pamdev/topspin.htm
Burnout Paradise,504,"Racing, Arcade","Jan 22, 2008",Rated E10+,10,8.0,"PlayStation 3, Xbox 360","Electronic Arts, Criterion Games",Electronic Arts,"Burnout Crash!, Burnout Dominator, Burnout Legends, Burnout Revenge, Burnout 3: Takedown, Burnout 2: Point of Impact, Burnout","city, race, cars, car",88,28,33,Racing,https://rawg.io/games/burnout-paradise,https://www.ea.com/ea-studios/criterion-games
Asgard's Wrath,505,"Action, RPG","Oct 10, 2019",Rated M,0,10.4,PC,Sanzaru Games,Oculus Studios,Asgard's Wrath 2,VR,88,975,4751,RPG,https://rawg.io/games/asgards-wrath,https://www.oculus.com/asgards-wrath/
Wipeout Pure,506,Racing,"Mar 16, 2005",Rated E,0,10.4,PSP,Sony Studio Liverpool,SCEA,"WipEout 2048, WipEout Pulse, WipEout HD, Wipeout Fusion, Wipeout 3 (1999), Wipeout 64, Wipeout XL, Wipeout (1995)",exclusive,88,296,1031,Racing,https://rawg.io/games/wipeout-pure,Not defined
A Short Hike,507,"Adventure, Indie","Aug 18, 2020",Rated E,0,2.0,"PC, macOS, Linux, Nintendo Switch",adamgryu,adamgryu,No,"Singleplayer, Full controller support, Isometric",88,64,482,Indie,https://rawg.io/games/a-short-hike,http://www.ashorthike.com
XCOM 2: War of the Chosen,508,Strategy,"Aug 29, 2017",Rated T,13,10.4,"PlayStation 4, Linux, macOS, PC, Xbox One",Firaxis,2K Games,No,"Singleplayer, Steam Achievements, Multiplayer, Steam Cloud, Tactical, Turn-Based, Aliens",88,411,1167,Strategy,https://rawg.io/games/xcom-2-war-of-the-chosen,https://xcom.com
DUSK,509,"Action, Indie","Dec 10, 2018",Not rated,0,3.0,"Nintendo Switch, PC",David Szymanski,New Blood Interactive,No,"Singleplayer, Steam Achievements, Steam Cloud, Partial Controller Support, Horror, FPS, Gore, Steam Leaderboards, Online multiplayer, Retro, Fast-Paced",88,130,655,Indie,https://rawg.io/games/dusk,http://www.NewBlood.info
Medieval: Total War,510,Strategy,"Aug 19, 2002",Rated T,0,1.0,PC,Creative Assembly,Activision Blizzard,"Total War: PHARAOH, Total War: WARHAMMER III, Total War Saga: TROY, Total War: ROME REMASTERED, Total War: THREE KINGDOMS, Total War Saga: Thrones of Britannia, Total War: WARHAMMER II, Total War, Total War: WARHAMMER, Total War Battles: KINGDOM, Total War: ATTILA, Total War: Rome II, Total War: ROME II - Emperor Edition, Total War Battles: SHOGUN, Total War: SHOGUN 2, Napoleon: Total War, Empire: Total War, Medieval II: Total War, ROME: Total War, Shogun: Total War",Not defined,88,106,2969,Strategy,https://rawg.io/games/medieval-total-war,https://www.totalwar.com
Shenmue,511,"Adventure, RPG, Simulation","Nov 7, 2000",Rated T,13,10.4,"Dreamcast, PC",SEGA,SEGA,"Shenmue III, Shenmue II",Singleplayer,88,52,964,Simulation,https://rawg.io/games/shenmue,Not defined
Excitebike 64,512,Not defined,"Apr 30, 2000",Rated E,0,10.4,Wii U,Nintendo,Nintendo,No,"console, friends, race, NES",88,8249,32065,Not in a rating,https://rawg.io/games/excitebike-64,Not defined
Tiger Woods PGA Tour 2005,513,Sports,"Sep 20, 2004",Rated E,0,10.4,"GameCube, PC, Xbox","Electronic Arts Sports, Headgate Studios",Electronic Arts,"Tiger Woods PGA TOUR 14, Tiger Woods PGA TOUR 13, Tiger Woods PGA TOUR 12: The Masters, Tiger Woods PGA Tour 11, Tiger Woods PGA Tour Online, Tiger Woods PGA Tour 10, Tiger Woods PGA Tour 08, Tiger Woods PGA Tour 07, Tiger Woods PGA Tour 06, Tiger Woods PGA Tour 2004, Tiger Woods PGA Tour 2003, Tiger Woods PGA Tour 2001, Tiger Woods PGA Tour Golf '99, Tiger Woods PGA Tour 2000, Tiger Woods PGA Tour 2000: Buick Tournament Courses, Tiger Woods PGA Tour 2002","Singleplayer, Multiplayer",88,392,1865,Sports,https://rawg.io/games/tiger-woods-pga-tour-2005,http://www.easports.com/games/tigerwoods2005/home.jsp
R4: Ridge Racer Type 4,514,Racing,"May 1, 1999",Rated E,10,10.4,"PSP, PlayStation 3, PS Vita",Sony Interactive Entertainment,Not defined,No,"Multiplayer, Controller, race, memory, racer, drift",88,860,2373,Racing,https://rawg.io/games/r4-ridge-racer-type-4,Not defined
Shadow Complex,516,"Action, Shooter","Aug 19, 2009",Rated T,13,24.0,Xbox 360,Chair EntertainmentEpic Games,Microsoft Studios,No,battle,88,128,548,Shooter,https://rawg.io/games/shadow-complex,Not defined
Call of Duty: Modern Warfare 3,517,"Action, Shooter","Nov 8, 2011",Rated M,17,8.0,"PC, macOS, Wii, Xbox 360, PlayStation 3, iOS, Xbox One","Aspyr Media, Raven Software, Treyarch, Infinity Ward, Sledgehammer Games, Neversoft Entertainment","Aspyr, Activision Blizzard, Activison, ak tronic Software & Services","Call of Duty: Modern Warfare III, Call of Duty: Warzone 2.0, Call of Duty: Modern Warfare II, Call of Duty: Vanguard, Call of Duty: Black Ops Cold War, Call of Duty: Modern Warfare 2 Campaign Remastered, Call of Duty: Warzone, Call of Duty: Modern Warfare (2019), Call of Duty: Mobile, Call of Duty: Black Ops 4, Call of Duty: WWII, Little Nightmares: The Depths, Call of Duty: Infinite Warfare, Call of Duty: Modern Warfare Remastered, Call of Duty: Black Ops III, Call of Duty: Advanced Warfare, Call of Duty: Ghosts, Call of Duty: Black Ops II, Call of Duty: Black Ops, Call of Duty: Modern Warfare 2, Call of Duty: World at War, Call of Duty 4: Modern Warfare, Call of Duty: Roads to Victory, Call of Duty 3, Call of Duty 2: Big Red One, Call of Duty 2, Call of Duty: Finest Hour, Call of Duty: United Offensive, Call of Duty","Singleplayer, Steam Achievements, Multiplayer, Steam Cloud, Co-op, cooperative, First-Person, FPS, Online Co-Op, Survival, Controller, Zombies, Point & Click, War, Military, Valve Anti-Cheat enabled, Linear",88,15,85,Shooter,https://rawg.io/games/call-of-duty-modern-warfare-3,http://www.callofduty.com
What Remains of Edith Finch,518,"Adventure, Indie","Apr 25, 2017",Rated T,13,3.0,"Xbox One, iOS, PC, Nintendo Switch, PlayStation 4","Annapurna Interactive, Giant Sparrow",Annapurna Interactive,No,"Singleplayer, Steam Achievements, Full controller support, Steam Cloud, Atmospheric, steam-trading-cards, Great Soundtrack, Story Rich, First-Person, Horror, FPS, Exploration, Female Protagonist, Short, Mystery, Walking Simulator, Visual Novel",88,17,52,Indie,https://rawg.io/games/what-remains-of-edith-finch,http://edithfinch.com/
Brothers in Arms: Road to Hill 30,519,Action,"Mar 1, 2005",Rated M,17,2.0,"Xbox, PC, Wii, PlayStation 2",Gearbox Software,Ubisoft Entertainment,"Brothers in Arms 3: Sons of War, Brothers In Arms 2: Global Front, Brothers in Arms D-Day, Brothers in Arms: Hour of Heroes, Brothers in Arms: Hell's Highway, Brothers in Arms Double Time, Brothers in Arms DS, Brothers in Arms: Earned in Blood, Brothers in Arms: Furious 4","Singleplayer, Multiplayer, FPS, Tactical, Historical, Military, World War II",88,47,2573,Action,https://rawg.io/games/brothers-in-arms-road-to-hill-30,http://www.brothersinarmsgame.com/us/roadtohill30/index.php
Deus Ex: Human Revolution - Director's Cut,520,"Action, RPG","Oct 22, 2013",Rated M,17,6.0,"Wii U, PC, macOS, Xbox 360, PlayStation 3","Feral Interactive, Eidos Montreal",Square Enix,No,"Singleplayer, Steam Achievements, Steam Cloud, Atmospheric, steam-trading-cards, Great Soundtrack, RPG, Story Rich, Open World, First-Person, Sci-fi, Partial Controller Support, FPS, Stealth, Action RPG, Captions available, Replay Value, Futuristic, combat, Cyberpunk, Dystopian, Story, Commentary available, character, Conspiracy, Hacking, weapons, Inventory Management, secrets, Transhumanism",88,18,43,RPG,https://rawg.io/games/deus-ex-human-revolution-directors-cut,http://www.deusex.com/
Tetris Effect: Connected,521,"Casual, Indie, Puzzle","Nov 10, 2020",Rated E,0,3.0,"Xbox Series S/X, PlayStation 4, Nintendo Switch, PC, Xbox One","Resonair, Monstars, Stage Games",Enhance,Tetris Effect,"Singleplayer, Steam Achievements, Multiplayer, Full controller support, Steam Cloud, Great Soundtrack, Co-op, cooperative, Online Co-Op, Steam Leaderboards, Split Screen, Local Co-Op, Controller, Local Multiplayer, PvP, Cross-Platform Multiplayer, Colorful, VR, Online PvP, Stylized, Beautiful, Remote Play Together, Shared/Split Screen Co-op, Score Attack, Psychedelic, Abstract, Shared/Split Screen PvP, Tutorial",88,54,91,Puzzle,https://rawg.io/games/tetris-effect-connected,https://tetriseffect.game
Dishonored,522,"Action, Adventure, RPG","Oct 9, 2012",Rated M,17,10.0,"PlayStation 4, PlayStation 3, Xbox 360, PC, Xbox One","Bethesda Softworks, Arkane Studios",Bethesda Softworks,"Dishonored: Death of the Outsider, Dishonored 2","Singleplayer, Steam Achievements, Full controller support, Steam Cloud, Atmospheric, RPG, Story Rich, Open World, First-Person, Sci-fi, FPS, Fantasy, Stealth, Dark, Replay Value, Magic, Multiple Endings, Dystopian, Steampunk, Assassin",88,8,10,Adventure,https://rawg.io/games/dishonored,http://www.dishonored.com
CTR: Crash Team Racing,523,"Action, Racing","Oct 19, 1999",Rated E,0,10.4,"PlayStation 3, PSP, PlayStation",Naughty Dog,Sony Computer Entertainment,"Crash Bandicoot: On the Run!, Crash Bandicoot: On the Run‪, Crash Bandicoot 4: It’s About Time, Crash Team Racing Nitro-Fueled, Crash Bandicoot: Crash's Revenge, Crash Bandicoot Nitro Kart 2, Crash: Mind Over Mutant, Crash Bandicoot: Mind over Mutant, Crash Nitro Kart 2, Crash of the Titans, Crash Boom Bang!, Crash Tag Team Racing, Crash Twinsanity, Crash Bandicoot Purple: Ripto's Rampage, Crash Nitro Kart, Crash Bandicoot 2: N-Tranced, Crash Bandicoot: The Huge Adventure, Crash Bandicoot: The Wrath of Cortex, Crash Bash, Crash Bandicoot 3: Warped, Crash Bandicoot 2: Cortex Strikes Back, Crash Bandicoot","Singleplayer, Multiplayer, exclusive",88,35,243,Racing,https://rawg.io/games/ctr-crash-team-racing,Not defined
Crusader Kings II: The Old Gods,524,Strategy,"May 28, 2013",Not rated,0,10.4,PC,Paradox Development Studio,Paradox Interactive,No,Not defined,88,1012,7020,Strategy,https://rawg.io/games/crusader-kings-ii-the-old-gods,http://www.paradoxplaza.com/games/crusader-kings-ii-the-old-gods
Lorelei and the Laser Eyes,526,"Adventure, Indie","May 16, 2024",Rated T,0,1.0,PC,Simogo,Annapurna Interactive,No,"Singleplayer, Steam Achievements, Full controller support, Steam Cloud, Story Rich, Horror, Exploration, Female Protagonist, Action-Adventure, Mystery, Dark Fantasy, 3D, Steam Trading Cards, Stylized, Psychological, Протагонистка, Family Sharing",88,199,8644,Adventure,https://rawg.io/games/lorelei-and-the-laser-eyes,https://annapurnainteractive.com/en/games/lorelei-and-the-laser-eyes
Superbike 2001,528,"Simulation, Sports, Racing","Oct 9, 2000",Rated E,0,20.0,PC,Milestone,Electronic Arts,No,Not defined,88,467,2052,Racing,https://rawg.io/games/superbike-2001,Not defined
Ultimate Fighting Championship,529,"Sports, Fighting","Aug 29, 2000",Rated T,0,10.4,"Dreamcast, PlayStation, Game Boy Color","Opus, Anchor, Fluid Studios",Crave Entertainment,No,"Singleplayer, Multiplayer",88,433,826,Fighting,https://rawg.io/games/ultimate-fighting-championship,Not defined
Medal of Honor: Frontline,530,Shooter,"May 29, 2002",Rated T,13,10.4,"PlayStation 3, Xbox, GameCube, PlayStation 2","Electronic Arts, Electronic Arts Los Angeles, Danger Close Games",Electronic Arts,"Medal of Honor: Above and Beyond, Medal of Honor: Warfighter, Medal of Honor, Medal of Honor Heroes 2, Medal of Honor: Airborne, Medal of Honor: Vanguard, Medal of Honor: Heroes, Medal of Honor: European Assault, Medal of Honor: Pacific Assault, Medal of Honor: Allied Assault War Chest, Medal of Honor: Infiltrator, Medal of Honor: Rising Sun, Medal of Honor Allied Assault: Breakthrough, Medal of Honor Allied Assault: Spearhead, Medal of Honor: Allied Assault, Medal of Honor: Underground, Medal of Honor (1999)","Singleplayer, Multiplayer, FPS, online, battle, World War II",88,48,635,Shooter,https://rawg.io/games/medal-of-honor-frontline,Not defined
Mario Kart 8,531,Racing,"May 30, 2014",Rated E,0,13.0,Wii U,Nintendo,Nintendo,"Mario Kart Live: Home Circuit, Mario Kart Tour, Mario Kart 8 Deluxe, Mario Kart 7, Mario Kart Wii, Mario Kart DS, Mario Kart: Double Dash, Mario Kart: Super Circuit (2001), Mario Kart 64 (1996), Super Mario Kart","Multiplayer, online, battle, Underwater, race, speed, animation, Gravity, random, mario, zelda",88,394,230,Racing,https://rawg.io/games/mario-kart-8,http://mariokart8.nintendo.com/wiiu/
Super Mario Maker,532,Platformer,"Sep 11, 2015",Rated E,0,10.0,"Wii U, Nintendo 3DS",Nintendo,Nintendo,"Mario Maker 2, Super Mario Maker 2",Side-Scrolling,88,746,346,Platformer,https://rawg.io/games/super-mario-maker,http://supermariomaker.nintendo.com/
Tekken 5,533,Fighting,"Feb 24, 2005",Rated T,13,10.4,PlayStation 2,NAMCO,"Namco, SCEE","Tekken 8, Tekken Training gym, Tekken Mobile, TEKKEN 7, Tekken Arena, Tekken Revolution, Tekken Card Tournament, Tekken Tag Tournament 2, Tekken Hybrid, TEKKEN 6, Tekken Advance, Tekken 4, Tekken Tag Tournament, Tekken 3, Tekken 2 (1995), Tekken (1994)","Dark, balance",88,92,157,Fighting,https://rawg.io/games/tekken-5,http://www.bandainamcogames.co.jp/cs/list/tekken5
F.E.A.R.,534,"Action, Shooter","Oct 17, 2005",Rated M,18,2.0,"PC, PlayStation 3, Xbox 360","Monolith Productions, Day 1 Studios, Timegate","Warner Bros. Interactive, Vivendi Universal Games","F.E.A.R. Online, F.E.A.R. 3, F.E.A.R. 2: Project Origin","Singleplayer, Multiplayer, Atmospheric, Great Soundtrack, Story Rich, First-Person, Sci-fi, Horror, FPS, Gore, Classic, Dark, Survival Horror, Masterpiece, Bullet Time",88,4,108,Shooter,https://rawg.io/games/f-e-a-r,http://www.whatisfear.com/
Psychonauts,535,"Action, Platformer","Apr 20, 2005",Rated T,13,4.0,"PlayStation 3, Xbox One, iOS, PC, macOS, Linux, Xbox 360, PlayStation 2, PlayStation 4, Xbox",Double Fine Productions,"Microsoft Studios, THQ Nordic, Xbox Game Studios, Double Fine Productions","Psychonauts 2, Psychonauts In The Rhombus Of Ruin","Singleplayer, Steam Achievements, Steam Cloud, steam-trading-cards, Great Soundtrack, Story Rich, Third Person, Partial Controller Support, Funny, Exploration, Classic, Comedy, Action-Adventure, Cute, 3D, 3D Vision, Surreal, 3D Platformer, Cartoony, Cult Classic, Psychological",88,2,8,Platformer,https://rawg.io/games/psychonauts,http://www.psychonauts.com/
The Binding of Isaac: Rebirth,536,"Action, RPG","Nov 4, 2014",Rated M,17,30.0,"Xbox One, macOS, Linux, Nintendo Switch, Nintendo 3DS, Wii U, PlayStation 4, PS Vita, iOS, PC","Nicalis, Edmund McMillen",Nicalis,The Binding of Isaac,"Singleplayer, Steam Achievements, Full controller support, Steam Cloud, Atmospheric, steam-trading-cards, Great Soundtrack, Co-op, cooperative, 2D, Horror, Gore, Difficult, Split Screen, Local Co-Op, Pixel Graphics, Dark, Replay Value, Roguelike, Remake, Roguelite, Dungeon Crawler, Procedural Generation, Twin Stick Shooter",88,31,80,RPG,https://rawg.io/games/the-binding-of-isaac-rebirth,http://www.bindingofisaac.com
Tactical Breach Wizards,537,"Adventure, RPG, Strategy, Indie","Aug 22, 2024",Not rated,0,8.0,PC,Suspicious Developments,Suspicious Developments,No,"Singleplayer, RPG",88,8249,4958,Strategy,https://rawg.io/games/tactical-breach-wizards,http://wizards.cool
NHL 10,538,Sports,"Sep 15, 2009",Rated E10+,10,10.4,"PlayStation 3, Xbox 360",Electronic Arts Canada,Electronic Arts,"NHL 23, NHL 22, NHL 94 REWIND, NHL 21, NHL 20, EA SPORTS NHL 17, EA SPORTS NHL 16, NHL 15, NHL 14, NHL 13, NHL 12, NHL 11, NHL 09, NHL 08, NHL 07, NHL 2005, NHL 2000, NHL 98, NHL 97, NHL 96","Physics, battle",88,270,430,Sports,https://rawg.io/games/nhl-10,http://nhl.easports.com
BioShock 2,539,"Action, Shooter","Feb 9, 2010",Rated M,0,3.0,"PlayStation 4, Xbox One, Nintendo Switch, PC, macOS, Xbox 360, PlayStation 3","Feral Interactive, 2K, Digital Extremes, 2K Australia, 2K Marin, 2K China","2K Games, Feral Interactive","Bioshock Pinball, BioShock 2: Minerva's Den Remastered, BioShock Infinite, BioShock 2: The Protector Trials, BioShock 2: Sinclair Solutions Test Pack, BioShock: Challenge Rooms, BioShock, BioShock 4","Singleplayer, Steam Achievements, Multiplayer, Full controller support, Atmospheric, Great Soundtrack, RPG, Story Rich, First-Person, Sci-fi, Horror, FPS, Action RPG, Dark, Dystopian, Steampunk, Linear, Underwater, Philisophical",88,3,19,Shooter,https://rawg.io/games/bioshock-2,http://www.bioshockgame.com
