game_name,place_in_top,genres,release_date,rated_age_letter,age_restriction,avg_playtime,platforms,developers,publisher,other_games_in_series,tags,metascore_rating,place_in_that_year,place_in_rawq_by_genre,genre_of_this_place,game_link,website
Resident Evil 7: biohazard,1004,"Action, Shooter, Adventure","Jan 24, 2017",Rated M,17,10.0,"PlayStation 4, PC, Xbox One, Nintendo Switch","Capcom, Capcom U.S.A",Capcom,"Resident Evil 4, Resident Evil: Village, Resident Evil 3, Resident Evil 2, Umbrella Corps /Biohazard Umbrella Corps, Resident Evil Revelations 2, Resident Evil 6, Resident Evil: Operation Raccoon City, Resident Evil Revelations, Resident Evil: The Darkside Chronicles, Resident Evil 5, Resident Evil: The Umbrella Chronicles, Resident Evil 4 (2005), Resident Evil Zero, Resident Evil Code: Veronica, Resident Evil 3: Nemesis, Resident Evil 2 (1998), Resident Evil Director's Cut, Resident Evil","Singleplayer, Steam Achievements, Multiplayer, Full controller support, Steam Cloud, Atmospheric, steam-trading-cards, Story Rich, First-Person, Horror, FPS, Gore, Exploration, Classic, Survival, Violent, Action-Adventure, Zombies, Survival Horror, Cinematic, Memes, VR, Detective, America",86,10,22,Adventure,https://rawg.io/games/resident-evil-7-biohazard,http://residentevil7.com
NHL 12,1005,Sports,"Sep 13, 2011",Rated E10+,10,10.4,"PlayStation 3, Xbox 360",Electronic Arts Canada,Electronic Arts,"NHL 23, NHL 22, NHL 94 REWIND, NHL 21, NHL 20, EA SPORTS NHL 17, EA SPORTS NHL 16, NHL 15, NHL 14, NHL 13, NHL 11, NHL 10, NHL 09, NHL 08, NHL 07, NHL 2005, NHL 2000, NHL 98, NHL 97, NHL 96","skill, speed, ice, hockey",86,316,479,Sports,https://rawg.io/games/nhl-12,http://www.ea.com/nhl/1/nhl-12
Rise of the Tomb Raider,1006,Action,"Nov 10, 2015",Rated M,0,15.0,"Xbox One, PC, macOS, PlayStation 4","Feral Interactive, Crystal Dynamics, Nixxes","Square Enix, Microsoft Studios, Feral Interactive","Shadow of the Tomb Raider, Lara Croft GO, Lara Croft: Relic Run, Lara Croft and the Temple of Osiris, Tomb Raider (2013), Lara Croft and the Guardian of Light, Tomb Raider: Underworld, Tomb Raider: Anniversary, Lara Croft Tomb Raider: Legend, Tomb Raider: Legend, Tomb Raider: The Angel of Darkness, Tomb Raider: The Prophecy, Tomb Raider: Curse of the Sword, Tomb Raider V: Chronicles, Tomb Raider (GBC), Tomb Raider Starring Lara Croft, Tomb Raider 3: The Lost Artifact, Tomb Raider: The Last Revelation + Chronicles, Tomb Raider IV: The Last Revelation, Tomb Raider 2: Golden Mask, Tomb Raider 3: Adventures of Lara Croft, Tomb Raider II, Tomb Raider","Singleplayer, Steam Achievements, Full controller support, Steam Cloud, Atmospheric, steam-trading-cards, Great Soundtrack, RPG, Story Rich, Open World, Third Person, Steam Leaderboards, Exploration, Female Protagonist, Survival, Stealth, Action-Adventure, Third-Person Shooter, Parkour, Quick-Time Events, Lara Croft",86,5,26,Action,https://rawg.io/games/rise-of-the-tomb-raider,http://www.tombraider.com/us/
Chants of Sennaar,1007,"Adventure, Indie, Puzzle","Sep 5, 2023",Not rated,0,9.0,"Xbox One, PlayStation 4, Nintendo Switch, PC",Rundisc,Focus Entertainment,No,"Singleplayer, Action-Adventure, Colorful, Puzzle Platformer",86,71,498,Puzzle,https://rawg.io/games/chants-of-sennaar,https://www.focus-entmt.com/games/chants-of-sennaar
Advance Wars: Days of Ruin,1008,Not defined,"Jan 21, 2008",Rated E10+,0,5.0,Nintendo DS,Not defined,Nintendo,"Advance Wars 1+2: Re-Boot Camp, Advance Wars: Dual Strike, Advance Wars 2: Black Hole Rising, Advance Wars, Super Famicom Wars, Game Boy Wars, Famicom Wars","battle, Trading, environment",86,8249,32065,Not in a rating,https://rawg.io/games/advance-wars-days-of-ruin,Not defined
PlayerUnknown's Battlegrounds,1009,"Action, Shooter, Massively Multiplayer","Dec 21, 2017",Rated T,0,30.0,"PC, Xbox One, PlayStation 4","Krafton, Bluehole, PUBG","KRAFTON, Bluehole",PUBG Lite PC,"Multiplayer, Co-op, Open World, cooperative, First-Person, FPS, Online Co-Op, Survival, Violent, Online multiplayer, Tactical, Third-Person Shooter, PvP, Battle Royale",86,5,4,Massively,https://rawg.io/games/playerunknowns-battlegrounds,http://www.playbattlegrounds.com
Forza Horizon 2,1010,"Racing, Arcade","Sep 30, 2014",Not rated,10,2.0,"Xbox One, Xbox 360","Sumo Digital, Playground Games",Microsoft Studios,"Forza Horizon 5, Forza Horizon 4, Forza Horizon 3, Forza Horizon","Singleplayer, Multiplayer, Open World, exclusive, street racing",86,148,84,Racing,https://rawg.io/games/forza-horizon-2,https://forza.net/horizon
Monster Train,1011,"Strategy, Card","May 21, 2020",Not rated,13,8.0,"PC, iOS, Xbox One, Nintendo Switch","Good Shepherd Entertainment, Shiny Shoe","Good Shepherd Entertainment, Gambitious",No,"Singleplayer, Steam Achievements, Multiplayer, Steam Cloud, PvP, Roguelike, Online PvP, Turn-Based Combat, Card Game, deckbuilding, Card Battler",86,81,13,Card,https://rawg.io/games/monster-train,https://www.themonstertrain.com
Escape from Monkey Island,1013,Adventure,"Nov 8, 2000",Rated T,0,1.0,PC,LucasArts Entertainment,"Disney Interactive, LucasArts Entertainment",No,"Singleplayer, Steam Cloud, Point & Click",86,26,1586,Adventure,https://rawg.io/games/escape-from-monkey-island,Not defined
Europa Universalis,1014,Strategy,"Feb 2, 2001",Rated E,0,1.0,PC,Paradox Development Studio,Paradox Interactive,No,Singleplayer,86,135,3530,Strategy,https://rawg.io/games/europa-universalis,Not defined
Moto Racer Advance,1015,Racing,"Dec 5, 2002",Rated E,0,10.4,Game Boy Advance,"Adeline Software International, Delphine Software International",Ubisoft Entertainment,"Moto Racer 4, Moto Racer Collection, Moto Racer DS, Moto Racer 3, Moto Racer World Tour, Moto Racer 2, Moto Racer","Singleplayer, Multiplayer, exclusive, true exclusive",86,588,2456,Racing,https://rawg.io/games/moto-racer-advance,Not defined
Beat Saber,1016,"Action, Indie","Nov 20, 2018",Rated E,13,7.0,"PC, PlayStation 5, PlayStation 4","Hyperbolic Magnetism, Beat Games","Oculus Studios, Hyperbolic Magnetism, Beat Games",No,"Singleplayer, Great Soundtrack, Steam Leaderboards, Early Access, VR, Music, Rhythm",86,44,301,Indie,https://rawg.io/games/beat-saber,http://beatsaber.com
SteamWorld Heist,1017,"Action, Adventure, RPG, Strategy, Indie, Platformer","Dec 10, 2015",Rated E10+,10,5.0,"Nintendo 3DS, PS Vita, Nintendo Switch, Wii U, PlayStation 4, iOS, PC, macOS, Linux",Image & Form,"Image & Form, Image & Form International","SteamWorld Build, SteamWorld Quest: Hand of Gilgamech, SteamWorld Dig 2, SteamWorld Dig, SteamWorld Tower Defense","Singleplayer, Steam Achievements, Full controller support, Steam Cloud, steam-trading-cards, Great Soundtrack, RPG, 2D, Sci-fi, Female Protagonist, role-playing, Turn-Based, controller support, Robots, Steampunk, Turn-Based Tactics, Heist",86,95,80,Platformer,https://rawg.io/games/steamworld-heist,http://imageform.se/game/steamworld-heist/
IL-2 Sturmovik: 1946,1018,Simulation,"Mar 13, 2007",Rated T,0,1.0,PC,"1C: Maddox Games, 1C:Maddox Games",1C Company,"IL-2 Sturmovik: Cliffs of Dover Blitz Edition, IL-2 Sturmovik: Battle of Stalingrad, IL-2 Shturmovik. Battle of Kursk - Combat Gunship Flight Simulator, IL-2 Sturmovik: Cliffs of Dover, IL-2 Sturmovik Birds of Prey, IL-2 Sturmovik: Pe-2, IL-2 Sturmovik: Forgotten Battles, IL-2 Sturmovik","Singleplayer, Multiplayer, Steam Cloud, Classic, Includes level editor, Moddable, Historical, Realistic, Military, World War II, Flight, TrackIR",86,46,425,Simulation,https://rawg.io/games/il-2-sturmovik-1946,Not defined
Wildermyth,1020,"RPG, Strategy, Indie","Jun 15, 2021",Not rated,0,4.0,"Linux, macOS, PC",Worldwalker Games,Worldwalker Games,No,"Singleplayer, RPG, role-playing",86,225,753,Strategy,https://rawg.io/games/wildermyth,http://wildermyth.com
Final Fantasy XIV: Heavensward,1021,"RPG, Massively Multiplayer","Jun 23, 2015",Rated T,0,10.4,"PC, PlayStation 3, PlayStation 4",Square Enix,Square Enix,No,Not defined,86,1138,455,Massively,https://rawg.io/games/final-fantasy-xiv-heavensward,http://na.finalfantasyxiv.com/heavensward/
Luigi's Mansion 3,1022,"Action, Family","Oct 31, 2019",Rated E,0,10.4,Nintendo Switch,Nintendo,Nintendo,"Luigi's Mansion: Dark Moon, Luigi's Mansion","exclusive, true exclusive",86,118,52,Family,https://rawg.io/games/luigis-mansion-3,https://www.nintendo.com/games/detail/luigis-mansion-3-switch/
Dance Central 3,1023,Simulation,"Oct 16, 2012",Rated T,13,3.0,Xbox 360,Harmonix Music Systems,Microsoft Studios,No,"exclusive, true exclusive",86,442,1503,Simulation,https://rawg.io/games/dance-central-3,Not defined
Luigi's Mansion: Dark Moon,1026,"Action, Adventure","Mar 24, 2013",Rated E,0,10.4,Nintendo 3DS,Next Level Games,Nintendo,"Luigi's Mansion 3, Luigi's Mansion","exclusive, true exclusive",86,493,3080,Adventure,https://rawg.io/games/luigis-mansion-dark-moon,http://luigismansion.nintendo.com/
DJ Hero 2,1027,Arcade,"Oct 19, 2010",Rated T,0,5.0,"Wii, PlayStation 3","Fireproof Studios, FreeStyleGames",Activision Blizzard,"Guitar Hero Live, Guitar Hero: Warriors of Rock, Guitar Hero: Van Halen, Band Hero, DJ Hero, Guitar Hero 5, Guitar Hero: Smash Hits, Guitar Hero On Tour: Modern Hits, Guitar Hero: Metallica, Guitar Hero On Tour: Decades, Guitar Hero World Tour, Guitar Hero: Aerosmith, Guitar Hero: On Tour, Guitar Hero III: Legends of Rock, Guitar Hero Encore: Rocks the 80s, Guitar Hero II, Guitar Hero, Guitar Hero Arcade","Music, Rhythm",86,355,743,Arcade,https://rawg.io/games/dj-hero-2,http://www.djhero.com/en-us/games/view/djh2
Dragon's Dogma 2,1028,"Action, Adventure, RPG","Mar 22, 2024",Rated M,0,28.0,"PC, PlayStation 5, Xbox Series S/X",Capcom,Capcom,"Dragon's Dogma Online, Dragon's Dogma Quest, Dragon's Dogma: Dark Arisen, Dragon's Dogma","Singleplayer, Steam Achievements, Steam Cloud, RPG, Open World, Third Person, Partial Controller Support, Fantasy, Exploration, Action-Adventure, Action RPG, Character Customization, Physics, 3D, Medieval, Magic, Steam Trading Cards, PvE, Lore-Rich, Dragons, Swordplay, Family Sharing, Artificial Intelligence, HDR available",86,16,1122,RPG,https://rawg.io/games/dragons-dogma-2,https://www.dragonsdogma.com/2/
Armored Core VI: Fires of Rubicon,1029,Action,"Aug 25, 2023",Rated T,13,13.0,"PC, Xbox One, Xbox Series S/X, PlayStation 4, PlayStation 5",FromSoftware,"Bandai Namco Entertainment, FromSoftware, From Software","Armored Core: Verdict Day, ARMORED CORE V, Armored Core: For Answer, Armored Core 4, Armored Core: Last Raven, Armored Core: Formula Front - Extreme Battle, Armored Core: Nine Breaker, Armored Core: Formula Front, Armored Core: Nexus, Silent Line: Armored Core, Armored Core 3, Armored Core 2: Another Age, Armored Core 2, Armored Core: Master of Arena, Armored Core: Project Phantasma, Armored Core","Singleplayer, Multiplayer, Steam Cloud, Atmospheric, Co-op, cooperative, Third Person, Sci-fi, Action-Adventure, Character Customization, Post-apocalyptic, 3D, Futuristic, combat, Fast-Paced, Military, Robots, Soundtrack, Souls-like, Mechs, Постапокалипсис, Vehicular Combat, Un jugador, Logros de Steam, Cromos de Steam, Multijugador, JcJ, JcJ en línea, Compat. parcial con mando",86,36,2928,Action,https://rawg.io/games/armored-core-vi-fires-of-rubicon,Not defined
Battlefield 3: Back to Karkand,1030,Shooter,"Dec 13, 2011",Rated M,0,10.4,"PC, PlayStation 3",Electronic Arts DICE,Electronic Arts,No,Not defined,86,503,1417,Shooter,https://rawg.io/games/battlefield-3-back-to-karkand,http://www.battlefield.com/uk/battlefield3/1/back-to-karkand
Dragon Quest XI: Echoes of an Elusive Age,1031,RPG,"Sep 4, 2018",Rated T,13,15.0,"PC, PlayStation 4, Xbox One, Nintendo Switch, Nintendo 3DS","Square Enix, Armor Project",Square Enix,"Dragon Quest Builders 2, DRAGON QUEST HEROES II, Dragon Quest VII: Fragments of the Forgotten Past, Dragon Quest Monsters: Joker 3, DRAGON QUEST BUILDERS, DRAGON QUEST HEROES: The World Tree's Woe and the Blight Below, Dragon Quest Monsters 2: Iru to Ruka no Fushigi na Fushigi na Kagi, Dragon Quest X, Dragon Quest Monsters: Terry's Wonderland 3D, Slime MoriMori Dragon Quest 3: Daikaizoku to Shippo Dan, Dragon Quest Monsters: Joker 2, Dragon Quest Monsters: Joker 2 Professional, Dragon Quest VI: Realms Of Revelation, Dragon Quest: Monster Battle Road Victory, Dragon Quest Wars, Dragon Quest IX: Sentinels of the Starry Skies, Dragon Quest V: Hand of the Heavenly Bride, Dragon Quest IV: Chapters of the Chosen, Dragon Quest Monsters: Joker, Dragon Quest Heroes: Rocket Slime, Dragon Quest VIII: Journey of the Cursed King, Slime MoriMori Dragon Quest: Shōgeki no Shippo Dan, Dragon Quest Monsters: Caravan Heart, Dragon Quest Characters: Torneko no Daibōken 3, Dragon Quest 7, Torneko: The Last Hope, Dragon Quest 6: Realms of Revelation, Torneko's Great Adventure: Mystery Dungeon, DRAGON QUEST V, Dragon Quest III (1988), Dragon Quest II (1987), Dragon Quest (1986), Dragon Quest: Shounen Yangus to Fushigi no Dungeon, Dragon Quest XII: The Flames of Fate, Dragon Quest: Monster Battle Scanner","Singleplayer, Steam Achievements, Full controller support, Steam Cloud, steam-trading-cards, Great Soundtrack, RPG, Story Rich, Fantasy, Anime, Turn-Based, JRPG, Turn-Based Combat",86,122,398,RPG,https://rawg.io/games/dragon-quest-xi-echoes-of-an-elusive-age,https://www.DQ11.com
F-Zero: Maximum Velocity,1032,"Racing, Arcade","Jun 12, 2001",Rated E,0,10.4,Wii U,Nintendo,Nintendo,No,"console, race, speed, galaxy, NES, metal",86,1867,2184,Racing,https://rawg.io/games/f-zero-maximum-velocity,Not defined
Destiny: The Taken King,1033,"Action, Shooter, RPG","Sep 15, 2015",Rated T,13,10.4,"PlayStation 4, Xbox 360, PlayStation 3, Xbox One",Bungie,Activision Blizzard,No,"battle, character, pack",86,2230,1383,Shooter,https://rawg.io/games/destiny-the-taken-king,http://www.destinythegame.com/taken-king
Heroes of the Storm,1034,"Action, RPG, Strategy","Jun 2, 2015",Rated T,13,12.0,"PC, macOS",Not defined,Blizzard Entertainment,No,MOBA,86,494,1000,Strategy,https://rawg.io/games/heroes-of-the-storm,http://us.blizzard.com/en-us/games/heroes
Turok 2: Seeds of Evil,1036,"Action, Shooter, Adventure","Dec 10, 1998",Rated M,13,1.0,"Xbox One, Nintendo 64, PC, Nintendo Switch, PlayStation 4","Nightdive Studios, Iguana Entertainment, Acclaim Studios Austin","Nightdive Studios, Acclaim Entertainment, Night Dive Studios",No,"Singleplayer, Steam Achievements, Multiplayer, Steam Cloud, Great Soundtrack, Sci-fi, Partial Controller Support, FPS, Gore, Classic, Violent, Online multiplayer, Split Screen, Dinosaurs",86,16,409,Shooter,https://rawg.io/games/turok-2-seeds-of-evil,http://www.nightdivestudios.com/games/turok-2-seeds-of-evil/?utm_source=steampowered.com&amp;utm_medium=product&amp;utm_campaign=website%20-%20turok%202%20seeds%20of%20evil
Path of Exile,1038,"Action, RPG, Massively Multiplayer, Indie","Oct 23, 2013",Not rated,0,6.0,"Xbox One, PlayStation 4, PC",Grinding Gear Games,Grinding Gear Games,Path of Exile 2,"Singleplayer, Steam Achievements, Multiplayer, steam-trading-cards, RPG, Co-op, cooperative, Online Co-Op, Fantasy, Free to Play, Online multiplayer, Action RPG, Hack and Slash, In-App Purchases, Character Customization, Dark Fantasy, mmo, Dungeon Crawler, MMORPG, PvE, Loot, Inventory Management, Fishing",86,8,3,Massively,https://rawg.io/games/path-of-exile,http://www.pathofexile.com
Returnal,1039,"Action, Shooter","Apr 30, 2021",Rated T,0,10.0,"PC, PlayStation 5","Housemarque, Climax Studios","Sony Interactive Entertainment, PlayStation PC",No,"Singleplayer, Steam Achievements, Multiplayer, Full controller support, Steam Cloud, Co-op, cooperative, Sci-fi, Horror, Online Co-Op, Difficult, Female Protagonist, Third-Person Shooter, Space, exclusive, Roguelike, true exclusive, Roguelite, Bullet Hell, Souls-like, Протагонистка, Action Roguelike, psychological-horror",86,34,308,Shooter,https://rawg.io/games/returnal,https://housemarque.com/games/returnal
Braid Anniversary Edition,1040,"Puzzle, Platformer","May 14, 2024",Not rated,0,10.4,"Xbox One, PC, macOS, Linux, Nintendo Switch, PlayStation 4, Xbox Series S/X, PlayStation 5",Number None,Not defined,No,Not defined,86,1016,790,Platformer,https://rawg.io/games/braid-anniversary-edition,http://braid-game.com/
Guilty Gear Xrd: Rev 2,1041,Fighting,"May 26, 2017",Rated T,13,10.4,PlayStation 4,Aksys Games,Not defined,No,"Story, apocalypse, brawler",86,577,165,Fighting,https://rawg.io/games/guilty-gear-xrd-rev-2,Not defined
OlliOlli2: Welcome to Olliwood,1042,"Action, Sports, Indie, Platformer","Mar 3, 2015",Rated T,13,1.0,"PlayStation 4, PS Vita, PC, Linux, macOS","Roll7, Roll 7",Devolver Digital,"OlliOlli World: Finding the Flowzone, OlliOlli World: VOID Riders, OlliOlli World, OlliOlli","Singleplayer, Steam Achievements, Multiplayer, Full controller support, Great Soundtrack, 2D, Difficult, Steam Leaderboards, Split Screen, Local Co-Op, Local Multiplayer, 4 Player Local, skateboarding, Skating",86,104,34,Sports,https://rawg.io/games/olliolli2,http://www.roll7.co.uk/#!olliolli2/ccko
Forza Motorsport 7,1044,Racing,"Sep 29, 2017",Rated E,0,10.4,"Xbox One, PC",Turn 10 Studios,Microsoft Studios,"Forza Motorsport, Forza Motorsport 6, Forza Motorsport 5, Forza Motorsport 4, Forza Motorsport 3, Forza Motorsport 2, Forza Motorsport (2005)","Multiplayer, exclusive, car, w10 exclusive",86,154,92,Racing,https://rawg.io/games/forza-motorsport-7,https://www.forzamotorsport.net/en-US/games/fm7
Sumire,1045,"Adventure, Casual, Indie","May 27, 2021",Not rated,10,3.0,"iOS, PC, Nintendo Switch","GameTomo Co, GameTomo",GameTomo Co,No,"Singleplayer, Steam Achievements, Atmospheric, Partial Controller Support, Female Protagonist, Controller, Anime, Cute, Choices Matter, Colorful, Relaxing, Emotional, Interactive Fiction, Beautiful, Протагонистка, Narrative",86,672,3847,Casual,https://rawg.io/games/sumire,https://www.gametomo.co.jp/sumire
ENDER LILIES: Quietus of the Knights,1046,"Action, RPG, Indie, Platformer","Jun 22, 2021",Rated T,0,4.0,"PlayStation 5, PC, Xbox One, PlayStation 4, Nintendo Switch","Live Wire, adglobe",Binary Haze Interactive,No,"Singleplayer, Steam Achievements, Full controller support, Steam Cloud, Atmospheric, RPG, 2D, Difficult, Female Protagonist, Action RPG, Early Access, Dark, Zombies, Post-apocalyptic, Dark Fantasy, Medieval, Multiple Endings, Metroidvania, Hand-drawn, Dragons, Souls-like, Протагонистка",86,184,274,Platformer,https://rawg.io/games/ender-lilies-quietus-of-the-knights,https://www.enderlilies.com/
Football Manager 2019,1047,"Simulation, Sports","Nov 2, 2018",Rated E,0,83.0,"Nintendo Switch, macOS, PC",Sports Interactive,SEGA,"Football Manager 2023, Football Manager 2022, Football Manager 2021, Football Manager 2020 Touch, Football Manager 2020, Football Manager Touch 2019, Football Manager Touch 2018, Football Manager 2018, Football Manager 2017, Football Manager Touch 2017, Football Manager 2016, Football Manager 2014, Football Manager 2013, Football Manager 2012, Football Manager 2011, Football Manager 2010, Football Manager Live, Football Manager (1982)","Singleplayer, Multiplayer, Management, Heist, Football, Soccer",86,358,294,Sports,https://rawg.io/games/football-manager-2019,http://www.footballmanager.com/
Gunman Clive HD Collection,1048,Action,"Sep 3, 2015",Rated E10+,0,10.4,"Wii U, PlayStation 4, Nintendo Switch",Hörberg Productions,Hörberg Productions,No,"battle, shoot, school, girl, cowboy",86,2698,14976,Action,https://rawg.io/games/gunman-clive-hd-collection,http://www.gunmanclive.com/
Persona 4 Arena,1049,Fighting,"Aug 7, 2012",Rated T,13,5.0,"PlayStation 3, Xbox 360","Atlus, Arc System Works",Atlus,"Persona 5 Tactica, Persona, Persona Q2: New Cinema Labyrinth, Persona 3: Dancing in Moonlight, Persona 5, Persona Q: Shadow of the Labyrinth, Shin Megami Tensei: Devil Summoner: Soul Hackers, Shin Megami Tensei: Devil Survivor Overclocked, Shin Megami Tensei: Imagine Online, Shin Megami Tensei: Persona 4, Shin Megami Tensei: Persona 3, Shin Megami Tensei: Digital Devil Saga 2, Shin Megami Tensei: Digital Devil Saga, Persona 2: Eternal Punishment, Shin Megami Tensei Persona 2: Innocent Sin, Shin Megami Tensei: Persona, Revelations: Persona, Shin Megami Tensei, Digital Devil Story: Megami Tensei II, Digital Devil Story: Megami Tensei, Persona 5: The Phantom X","2D, Anime, Story, arena",86,414,188,Fighting,https://rawg.io/games/persona-4-arena,http://www.atlus.com/p4arena/
Viewtiful Joe 2,1050,Action,"Nov 18, 2004",Rated T,0,10.4,"GameCube, PlayStation 2",Clover Studio,Capcom,"Viewtiful Joe Double Trouble, Viewtiful Joe: Red Hot Rumble, Viewtiful Joe (2003)",Singleplayer,86,193,9551,Action,https://rawg.io/games/viewtiful-joe-2,Not defined
Humanity,1051,"Action, Strategy, Casual, Indie, Puzzle","May 16, 2023",Rated E10+,0,2.0,"PC, PlayStation 5, PlayStation 4","Enhance Games, tha","Enhance, Enhance Games",No,"Singleplayer, Steam Achievements, Full controller support, Steam Cloud, Atmospheric, Story Rich, Third Person, Fantasy, Gore, Difficult, Exploration, Violent, Early Access, Includes level editor, Nudity, 3D, VR, Sexual Content, Stylized, Minimalist, Level Editor, Remote Play on TV, Puzzle Platformer, Logic, Dog, Lemmings, VR Supported",86,115,650,Puzzle,https://rawg.io/games/humanity,https://humanity.game
Day of the Tentacle Remastered,1052,"Adventure, Family","Mar 21, 2016",Not rated,13,3.0,"PS Vita, PlayStation 4, Xbox One, iOS, PC, Linux, macOS",Double Fine Productions,Double Fine Productions,No,"Singleplayer, Steam Achievements, Full controller support, Steam Cloud, steam-trading-cards, 2D, Funny, Classic, Comedy, Point & Click, Remake, overlay, 1990's, Commentary available, Cartoony, Time Travel, cloud saves",86,74,11,Family,https://rawg.io/games/day-of-the-tentacle-remastered,http://dott.doublefine.com
Cyberpunk 2077,1053,"Action, Shooter, RPG","Dec 10, 2020",Rated M,17,28.0,"PlayStation 4, PC, Xbox Series S/X, PlayStation 5, Xbox One","CD PROJEKT RED, CD PROJEKT",CD PROJEKT RED,Cyberpunk: The Arasaka's Plot,"Singleplayer, Atmospheric, Great Soundtrack, RPG, Story Rich, Open World, First-Person, Sci-fi, FPS, Exploration, Sandbox, Violent, Action-Adventure, Action RPG, role-playing, Nudity, Mature, Cinematic, Futuristic, Sexual Content, Cyberpunk, Crime, Robots, 3rd-Person Perspective, Blood, America, Masterpiece, Soundtrack, Hacking, Role Playing Game, immersive, Photorealistic",86,1,5,RPG,https://rawg.io/games/cyberpunk-2077,https://www.cyberpunk.net/
Xenoblade Chronicles,1054,"Action, RPG","Apr 10, 2015",Rated T,13,14.0,"Nintendo 3DS, Wii",Monolith Soft,Nintendo,"Xenoblade Chronicles 3, Xenoblade Chronicles 2, Xenoblade Chronicles X, Xenosaga Episode III: Also sprach Zarathustra, Xenosaga I & II, Xenosaga Episode II: Jenseits von Gut und Bose, Xenosaga Episode I: Der Wille zur Macht, Xenogears (1998)","RPG, role-playing",86,244,1551,RPG,https://rawg.io/games/xenoblade-chronicles,Not defined
Fire Emblem Fates: Birthright,1055,"RPG, Strategy","Feb 19, 2016",Rated T,13,10.4,Nintendo 3DS,Intelligent Systems,Nintendo,"Fire Emblem Engage, Fire Emblem: Three Houses, Fire Emblem Warriors, Fire Emblem Echoes: Shadows of Valentia, Fire Emblem Heroes, Fire Emblem Fates: Revelation, Fire Emblem Fates: Conquest, Fire Emblem Awakening, Fire Emblem: New Mystery of the Emblem, Fire Emblem: Shadow Dragon, Fire Emblem: Radiant Dawn, Fire Emblem: Path of Radiance, Fire Emblem: The Sacred Stones, Fire Emblem: The Blazing Blade, Fire Emblem: The Binding Blade, Fire Emblem: Thracia 776, Fire Emblem: Genealogy of the Holy War, Fire Emblem: Mystery of the Emblem, Fire Emblem Gaiden, Fire Emblem: Shadow Dragon and the Blade of Light",role-playing,86,965,1612,Strategy,https://rawg.io/games/fire-emblem-fates-birthright,http://fireemblemfates.nintendo.com/
The Legend of Zelda: Twilight Princess HD,1056,"Action, RPG","Mar 4, 2016",Rated T,0,34.0,Wii U,Nintendo,Nintendo,No,"exclusive, true exclusive",86,706,1474,RPG,https://rawg.io/games/the-legend-of-zelda-twilight-princess-hd,http://zelda.com/twilight-princess-hd/
Tetris Party,1057,Not defined,"Oct 20, 2008",Rated E,0,1.0,Wii,Not defined,Tetris Online,No,puzzles,86,8249,32065,Not in a rating,https://rawg.io/games/tetris-party,Not defined
Allegiance,1058,Simulation,"Mar 31, 2000",Rated E,0,10.4,PC,Microsoft Research Games,Microsoft Studios,No,Not defined,86,592,7671,Simulation,https://rawg.io/games/allegiance,Not defined
Resogun: Heroes,1059,Arcade,"Jun 24, 2014",Rated E10+,10,1.0,"PS Vita, PlayStation 3, PlayStation 4","Sony Interactive Entertainment, Housemarque, Climax Group, XDev Studio Europe",Sony Computer Entertainment,No,exclusive,86,126,90,Arcade,https://rawg.io/games/resogun-heroes,http://us.playstation.com/ps4/games/resogun-ps4.html
Mini Metro,1060,"Strategy, Simulation, Indie, Puzzle","Aug 30, 2018",Rated E,0,3.0,"Nintendo Switch, iOS, PC, macOS, Linux, PlayStation 4, Android","Playdigious, Radial Games, Dinosaur Polo Club","AGM PLAYISM, Radial Games, Dinosaur Polo Club",Mini Motorways,"Singleplayer, Steam Achievements, Steam Cloud, steam-trading-cards, Great Soundtrack, 2D, Difficult, Steam Leaderboards, Building, Management, overlay, Relaxing, achievements, Touch-Friendly, Minimalist, Education, Mouse only, Solo, leaderboards, Trains, transportation",86,87,53,Puzzle,https://rawg.io/games/mini-metro,http://dinopoloclub.com/minimetro
The Legend of Zelda: Echoes of Wisdom,1062,Adventure,"Sep 26, 2024",Rated E10+,0,10.4,Nintendo Switch,Nintendo,Nintendo,No,Not defined,85,79,4675,Adventure,https://rawg.io/games/the-legend-of-zelda-echoes-of-wisdom,Not defined
