game_name,place_in_top,genres,release_date,rated_age_letter,age_restriction,avg_playtime,platforms,developers,publisher,other_games_in_series,tags,metascore_rating,place_in_that_year,place_in_rawq_by_genre,genre_of_this_place,game_link,website
NASCAR Thunder 2003,1546,"Simulation, Sports, Racing","Sep 29, 2002",Rated E,0,10.4,"Xbox, PlayStation, GameCube, PlayStation 2, PC","Electronic Arts Sports, Budcat Creations, Image Space",Electronic Arts,"NASCAR Kart Racing, NASCAR 09, NASCAR 08, NASCAR 07, NASCAR 06: Total Team Control, NASCAR SimRacing, NASCAR 2005: Chase for the Cup, NASCAR Thunder 2004, NASCAR Thunder 2002, NASCAR 2001, NASCAR Rumble, NASCAR 2000, NASCAR Revolution, NASCAR 99, NASCAR 98","Singleplayer, Multiplayer, Online multiplayer",84,296,1632,Racing,https://rawg.io/games/nascar-thunder-2003,Not defined
Puyo Pop,1547,Action,"Feb 11, 2002",Rated E,0,10.4,"Game Boy Advance, Neo Geo",Not defined,Not defined,No,"exclusive, true exclusive",84,8249,30752,Action,https://rawg.io/games/puyo-pop,Not defined
NASCAR: Dirt to Daytona,1548,Racing,"Nov 11, 2002",Rated E,0,10.4,"PlayStation 2, GameCube",Monster Games,"Infogrames, Infogrames Entertainment",No,"Singleplayer, Multiplayer",84,407,1999,Racing,https://rawg.io/games/nascar-dirt-to-daytona,Not defined
Rayman,1550,"Action, Adventure, Arcade","Jun 11, 2001",Rated E,0,3.0,"SEGA 32X, Jaguar, SEGA Saturn, Game Boy Color, PlayStation, Android, PC, Nintendo DS, iOS","Ubisoft, Sony Interactive Entertainment, Ubi Soft Entertainment","Ubisoft Entertainment, Feral Interactive, Nintendo, Gameloft","Mario + Rabbids Sparks of Hope, Rayman Mini, Mario + Rabbids Kingdom Battle, Rayman 3, Raving Rabbids: Alive & Kicking, Rayman Adventures, Rabbids Invasion: The Interactive TV Show, Rayman Fiesta Run, Rayman Legends, Rayman Jungle Run, Rayman Origins, Raving Rabbids Travel in Time, Rayman Kart, Rayman Raving Rabbids TV Party, Rayman Raving Rabbids 2, Rayman Raving Rabbids DS, Rayman Raving Rabbids, Rayman: Hoodlums' Revenge, Rayman 3: Hoodlum Havoc, Rayman Rush, Rayman M, Rayman: Revolution, Rayman: Brain Games, Rayman 2: The Great Escape, Rayman Forever","Multiplayer, Controller, Dark, character, nature, explore, balance, memory",84,27,460,Arcade,https://rawg.io/games/rayman,http://twitter.com/RaymanGame
Saints Row: The Third,1551,"Action, Adventure","Nov 15, 2011",Rated M,17,14.0,"Linux, PC, Xbox One, Xbox 360, PlayStation 3",Volition,THQ,"Saints Row (2022), Saints Row: Gat Out of Hell, Saints Row IV, Saints Row 2, Saints Row","Singleplayer, Multiplayer, Great Soundtrack, RPG, Co-op, Open World, cooperative, Third Person, Partial Controller Support, Online Co-Op, Funny, Sandbox, Female Protagonist, Comedy, Third-Person Shooter, Zombies, Character Customization, Crime, Satire",84,4,8,Adventure,https://rawg.io/games/saints-row-the-third,https://saintsrow.com/
Gran Turismo 5,1552,Racing,"Nov 24, 2010",Rated E,0,63.0,PlayStation 3,Polyphony Digital,Sony Computer Entertainment,"Gran Turismo 7, Gran Turismo Sport, Gran Turismo 6, Gran Turismo 4, Gran Turismo 3: A-Spec, Gran Turismo 2, Gran Turismo","exclusive, true exclusive",84,129,165,Racing,https://rawg.io/games/gran-turismo-5,http://www.gran-turismo.com
Tron 2.0,1553,Action,"Aug 26, 2003",Rated T,13,3.0,"Xbox, Game Boy Advance, Classic Macintosh, PC","Monolith Productions, Climax Group, Lavastorm Analytics","Disney Interactive, Buena Vista Interactive","Tron: Identity, TRON RUN/r, TRON: Evolution - The Video Game","Singleplayer, Multiplayer, Steam Cloud, Atmospheric, RPG, Sci-fi, FPS, Classic, Cyberpunk",84,53,2971,Action,https://rawg.io/games/tron-2-0,Not defined
Skate 2,1554,"Sports, Arcade","Jan 21, 2009",Rated T,13,10.4,"PlayStation 3, Xbox 360","Electronic Arts, Electronic Arts Black Box, Electronic Arts Vancouver",Electronic Arts,"Skate 3, skate., Skate 4",Not defined,84,136,200,Sports,https://rawg.io/games/skate-2,http://www.skate.ea.com
Broken Sword - Shadow of the Templars: Reforged,1555,"Adventure, Casual, Indie","Sep 19, 2024",Not rated,0,10.4,"Linux, macOS, PC",Revolution Software,Revolution Software,No,"Singleplayer, Steam Achievements, Full controller support, Steam Cloud, Story Rich, 2D, Funny, Exploration, Comedy, Point & Click, Family Friendly, Mystery, Historical, Cinematic, Story, Drama, puzzles, Hand-drawn, Kickstarter, Cartoony, Touch-Friendly, Soundtrack, Conspiracy, Investigation, Family Sharing, secrets, Remote Play on TV, Narrative, Remote Play on Tablet, Conversation, Remote Play on Phone, sword, ancient, click, characters, graphics, knights, key",84,8249,13381,Casual,https://rawg.io/games/broken-sword-shadow-of-the-templars-reforged,https://revolution.co.uk
Pokemon Ultra Moon,1556,RPG,"Nov 17, 2017",Rated E,13,10.4,Nintendo 3DS,Game Freak,"Nintendo, The Pokemon Company",No,Not defined,84,5915,10528,RPG,https://rawg.io/games/pokemon-ultra-moon,Not defined
Danmaku Unlimited 3,1557,"Action, Arcade, Casual, Indie","Mar 13, 2018",Rated E10+,0,1.0,"Android, PC, iOS, PlayStation 4, Nintendo Switch","Doragon Entertainment, Sunny Tam","Doragon Entertainment, Sunny Tam, Doragon",No,"Singleplayer, Steam Achievements, Full controller support, Steam Cloud, steam-trading-cards, Great Soundtrack, First-Person, Sci-fi, Steam Leaderboards, Shoot 'Em Up, Bullet Hell",84,2592,1215,Arcade,https://rawg.io/games/danmaku-unlimited-3,http://doragongames.com/danmaku3/
The Darkside Detective: A Fumble in the Dark,1558,"Adventure, Casual","Apr 15, 2021",Not rated,0,10.4,"PlayStation 5, PlayStation 4, macOS, Linux, Nintendo Switch, PC, Xbox One",Spooky Doorway,Akupara Games,No,"Realistic, Music, Demons, city, night, police, click",84,834,4879,Casual,https://rawg.io/games/the-darkside-detective-a-fumble-in-the-dark,Not defined
Borderlands,1559,"Action, Shooter, RPG","Oct 20, 2009",Rated M,18,10.0,"PC, Xbox 360, PlayStation 3","2K, Gearbox Software",2K Games,"New Tales from the Borderlands, Tiny Tina's Assault on Dragon Keep: A Wonderlands One-shot Adventure, Borderlands 3, Tales from the Borderlands: A Telltale Game Series, Borderlands: The Pre-Sequel, Borderlands Legends, Borderlands 2","Singleplayer, Steam Achievements, Multiplayer, Steam Cloud, RPG, Co-op, Open World, cooperative, First-Person, Sci-fi, Partial Controller Support, FPS, Online Co-Op, Funny, Gore, Comedy, Local Co-Op, Action RPG, Post-apocalyptic, Dark Humor, Loot",84,2,16,RPG,https://rawg.io/games/borderlands,http://www.borderlandsthegame.com/
Indigo Prophecy,1560,"Action, Adventure","Sep 20, 2005",Rated M,17,2.0,"Xbox, Android, PlayStation 4, PlayStation 2, PC, Xbox 360","Aspyr Media, Quantic Dream","Atari, Quantic Dream",No,Singleplayer,84,30,864,Adventure,https://rawg.io/games/indigo-prophecy,Not defined
Half-Minute Hero,1561,"Action, Shooter, RPG, Strategy, Arcade","Oct 13, 2009",Rated E10+,10,10.4,"PSP, PS Vita, PC","XSEED Games, Marvelous Entertainment, Opus Studio Company",XSEED Games,No,"RPG, online, Music, japan",84,563,1580,Arcade,https://rawg.io/games/half-minute-hero,http://www.halfminutehero.com
Madden NFL 11,1563,"Simulation, Sports","Aug 10, 2010",Rated E,0,10.4,"PSP, Xbox 360, Wii, PlayStation 2, PlayStation 3","Electronic Arts, Electronic Arts Tiburon",Electronic Arts,"Madden NFL 24, Madden NFL 23, Madden NFL 22, Madden NFL 21, Madden NFL 20, Madden NFL 19, Madden NFL 18, Madden NFL 17, Madden NFL 16, Madden NFL 15, Madden NFL 25, Madden NFL 13, Madden NFL 12, Madden NFL Arcade, Madden NFL 10, Madden NFL 09, Madden NFL 08, Madden NFL 07, Madden NFL 06","party, fun, history, Football, speed, snow, blocks",84,274,381,Sports,https://rawg.io/games/madden-nfl-11,http://maddennfl.easports.com
Age of Empires II: Definitive Edition,1564,Strategy,"Nov 14, 2019",Rated T,0,5.0,"PC, Xbox Series S/X","Forgotten Empires, Wicked Witch, Tantalus","Microsoft Studios, Xbox Game Studios",No,"Singleplayer, Steam Achievements, Steam Cloud, Online multiplayer, Local Multiplayer, Cross-Platform Multiplayer, Includes level editor, RTS",84,55,178,Strategy,https://rawg.io/games/age-of-empires-ii-definitive-edition,https://www.ageofempires.com/games/aoeii/
Fantasy Zone,1565,Not defined,"Jan 23, 2020",Rated E,0,10.4,Wii,Not defined,SEGA,Fantasy Zone II,"console, ship, guns, boss, NES, spaceship, shop",84,8249,32065,Not in a rating,https://rawg.io/games/fantasy-zone,Not defined
Mutant Mudds Deluxe,1567,"Action, Indie","Jun 13, 2013",Rated E,10,3.0,"PS Vita, PlayStation 4, Wii U, PC","Renegade Kid, NightHawk Interactive","Gambitious Digital Entertainment, Atooi",No,"Singleplayer, Steam Achievements, Steam Cloud, steam-trading-cards, Great Soundtrack, 2D, Partial Controller Support, Difficult, Steam Leaderboards, Pixel Graphics, Retro",84,321,1896,Indie,https://rawg.io/games/mutant-mudds-deluxe,http://www.mutantmuddsdeluxe.com
Anomaly Agent,1568,"Action, Adventure, Indie","Jan 24, 2024",Not rated,0,2.0,PC,Phew Phew Games,Phew Phew Games,No,"Singleplayer, Steam Achievements, Full controller support, Steam Cloud, Story Rich, 2D, Sci-fi, Action-Adventure, Action RPG, Pixel Graphics, Controller, Hack and Slash, Choices Matter, Colorful, Side Scroller, Cyberpunk, Multiple Endings, Linear, 1980s, 2D Fighter, 2D Platformer, 2D-платформер, Conversation, 2D-файтинг",84,163,7609,Adventure,https://rawg.io/games/anomaly-agent,Not defined
Thimbleweed Park,1569,"Adventure, Indie, Puzzle","Mar 30, 2017",Not rated,13,7.0,"PlayStation 4, Xbox One, Nintendo Switch, Android, PC, Linux, macOS, iOS",Terrible Toybox,Terrible Toybox,No,"Singleplayer, Steam Achievements, Full controller support, Steam Cloud, steam-trading-cards, Great Soundtrack, Story Rich, 2D, Third Person, Funny, Classic, Female Protagonist, Comedy, Pixel Graphics, Retro, Point & Click, Captions available, Mystery, overlay, Detective, puzzles",84,197,169,Puzzle,https://rawg.io/games/thimbleweed-park,https://thimbleweedpark.com/
F1 2019,1570,"Simulation, Sports, Racing","Jun 25, 2019",Rated E,0,8.0,"PC, Xbox One, PlayStation 4",Codemasters,Codemasters,No,"Singleplayer, Steam Achievements, Full controller support, Steam Cloud, Steam Leaderboards, Online multiplayer, Steam Workshop, VR, Driving, race, simulator, realism, sport",84,86,70,Sports,https://rawg.io/games/f1-2019,http://www.formula1game.com/
Dance Dance Revolution Konamix,1571,Not defined,"Apr 25, 2002",Rated E,0,10.4,PlayStation,Konami Digital Entertainment,Konami,"Dance Dance Revolution Universe 3, DanceDanceRevolution 2, Dance Dance Revolution: Hottest Party 4, DanceDanceRevolution, DanceDanceRevolution (2009), DanceDanceRevolution X2, Dance Dance Revolution: Hottest Party 3, DanceDanceRevolution S, Dance Dance Revolution X, Dance Dance Revolution: Hottest Party 2, Dance Dance Revolution: Disney Channel Edition, Dance Dance Revolution Universe 2, Dance Dance Revolution Hottest Party, Dance Dance Revolution Universe, Dance Dance Revolution Ultramix 2, Dance Dance Revolution SuperNova, Dance Dance Revolution Ultramix 3, Dance Dance Revolution Extreme, DanceDanceRevolution (1999), Dance Dance Revolution, Dance Dance Revolution Extreme 2, Dance Dance Revolution: Hottest Party 5, DanceDanceRevolution A, DDRMAX: Dance Dance Revolution, Dance Dance Revolution: Music Fit, Dance Dance Revolution X2","Singleplayer, Multiplayer",84,8249,32065,Not in a rating,https://rawg.io/games/dance-dance-revolution-konamix,Not defined
Medieval: Total War - Viking Invasion,1572,Strategy,"May 7, 2003",Rated T,0,10.4,PC,Creative Assembly,Activision Blizzard,No,Not defined,84,305,5709,Strategy,https://rawg.io/games/medieval-total-war-viking-invasion,Not defined
Battlefield Vietnam,1573,"Action, Shooter","Mar 14, 2004",Rated T,13,1.0,PC,Digital Illusions Canada,Electronic Arts,"Battlefield 2042, Battlefield V, Battlefield 1, Battlefield Hardline, Battlefield 4, Battlefield 3, Battlefield Play4Free, Battlefield Online, Battlefield: Bad Company 2, Battlefield 1943, Battlefield Heroes, Battlefield: Bad Company, Battlefield 2142, Battlefield 2: Modern Combat, Battlefield 2, Battlefield 1942, Battlefield","exclusive, true exclusive",84,118,862,Shooter,https://rawg.io/games/battlefield-vietnam,https://www.ea.com/tr-tr/games/battlefield/battlefield-vietnam
The Legend of Zelda,1574,"Action, Adventure, RPG","Jun 2, 2004",Rated E,0,6.0,"Nintendo Switch, Wii U, Wii, Game Boy Advance, Nintendo 3DS, NES",Nintendo,Nintendo,"The Legend of Zelda: Tears of the Kingdom, Zelda's Adventure, Cadence of Hyrule, The Legend of Zelda: Breath of the Wild, Hyrule Warriors Legends, The Legend of Zelda: Tri Force Heroes, Hyrule Warriors, The Legend of Zelda: A Link Between Worlds, The Legend of Zelda: Skyward Sword, The Legend Of Zelda: Four Swords Anniversary Edition, The Legend of Zelda: Spirit Tracks, The Legend of Zelda: Phantom Hourglass, The Legend of Zelda: Twilight Princess, The Legend of Zelda: The Minish Cap, The Legend of Zelda: Four Swords Adventures, The Legend of Zelda: The Wind Waker, The Legend of Zelda: Four Swords, The Legend of Zelda: Oracle of Ages, The Legend of Zelda: Oracle of Seasons, The Legend of Zelda: Majora's Mask, The Legend of Zelda: Ocarina of Time, Zelda's Adventure (1995), Link: The Faces of Evil, The Legend of Zelda: Link's Awakening (1993), The Legend of Zelda: A Link to the Past, Zelda II: The Adventure of Link","Dark, Epic, explore, secrets, sword, princess, zelda",84,1,918,RPG,https://rawg.io/games/the-legend-of-zelda,Not defined
Tom Clancy's Ghost Recon 2: Summit Strike,1575,Action,"Aug 2, 2005",Rated T,0,10.4,Xbox,Not defined,Not defined,"Tom Clancy's Ghost Recon Breakpoint, Tom Clancy's Ghost Recon Wildlands, Tom Clancy's Ghost Recon Phantoms, Tom Clancy's Ghost Recon: Future Soldier, Tom Clancy's Ghost Recon Shadow Wars, Tom Clancy's Ghost Recon Predator, Tom Clancy's Ghost Recon Advanced Warfighter 2, Tom Clancy's Ghost Recon: Advanced Warfighter, Tom Clancy's Ghost Recon 2, Tom Clancy's Ghost Recon: Jungle Storm, Tom Clancy's Ghost Recon: Island Thunder, Tom Clancy's Ghost Recon: Desert Siege, Tom Clancy's Ghost Recon, Tom Clancy's Ghost Recon Frontline","exclusive, true exclusive",84,336,14826,Action,https://rawg.io/games/tom-clancys-ghost-recon-2-summit-strike,Not defined
Baba Is You,1576,"Indie, Puzzle","Mar 13, 2019",Rated E,0,3.0,"Android, Nintendo Switch, Linux, macOS, PC, iOS","Hempuli, Hempuli Oy","Hempuli Oy, Hempuli",No,"Singleplayer, Full controller support, Steam Cloud, 2D, Horror, Includes level editor, puzzles",84,46,66,Puzzle,https://rawg.io/games/baba-is-you,http://www.hempuli.com/Baba/
Guild Wars Nightfall,1577,"Action, RPG, Massively Multiplayer","Oct 26, 2006",Rated T,0,10.4,PC,"ArenaNet, ArenaNet®",NCsoft,No,"Multiplayer, RPG, mmo",84,542,973,Massively,https://rawg.io/games/guild-wars-nightfall,http://www.guildwars.com
Sayonara Wild Hearts,1578,"Action, Casual, Indie","Sep 19, 2019",Rated E10+,10,2.0,"iOS, PlayStation 4, Xbox One, Nintendo Switch, macOS, PC",Simogo,Annapurna Interactive,No,"Singleplayer, Steam Achievements, Full controller support, Steam Cloud, Atmospheric, Great Soundtrack, Story Rich, Fantasy, Female Protagonist, Action-Adventure, Short, Colorful, 3D, Music, Stylized, Beautiful, LGBTQ+, Rhythm, Remote Play on TV, death, Remote Play on Tablet, balance, Remote Play on Phone, Dreams, dance, Swords, lasers",84,122,280,Casual,https://rawg.io/games/sayonara-wild-hearts,http://sayonarawildhearts.com
Disgaea 2: Dark Hero Days,1579,"Adventure, Strategy","Aug 29, 2006",Rated T,13,49.0,PSP,Nippon Ichi Software,NIS America,No,Monsters,84,592,5558,Strategy,https://rawg.io/games/disgaea-2-dark-hero-days,Not defined
Oddworld: Abe's Oddysee - New 'n' Tasty,1580,"Action, Adventure, Indie, Platformer","Jul 22, 2014",Rated T,13,4.0,"Xbox One, Wii U, PS Vita, PlayStation 3, PlayStation 4, Nintendo Switch, PC, macOS, Linux, Android, iOS","Oddworld Inhabitants, Just Add Water, Nephilim Games",Oddworld Inhabitants,"Oddworld: Soulstorm, Oddworld: The Oddboxx, Oddworld: Stranger's Wrath, Oddworld: Munch's Oddysee (1997), Oddworld Adventures 2, Oddworld Adventures, Oddworld: Abe's Exoddus, Oddworld: Abe's Oddysee","Singleplayer, Steam Achievements, Full controller support, Steam Cloud, Atmospheric, steam-trading-cards, 2D, Sci-fi, Funny, Difficult, Steam Leaderboards, Classic, Comedy, Stealth, controller support, Side Scroller, Remake, 3D Vision, Puzzle-Platformer, 2.5D, Cult Classic",84,60,56,Platformer,https://rawg.io/games/oddworld-abes-oddysee-new-n-tasty,http://www.oddworld.com/
Valkyrie Profile 2: Silmeria,1581,RPG,"Sep 26, 2006",Rated T,0,10.4,PlayStation 2,Tri-Ace,Not defined,"Valkyrie Elysium, VALKYRIE ANATOMIA -The Origin, Valkyrie Profile: Covenant of the Plume, Valkyrie Profile","exclusive, true exclusive",84,233,3845,RPG,https://rawg.io/games/valkyrie-profile-2-silmeria,Not defined
Enemy Territory: Quake Wars,1582,"Action, Shooter, Adventure","Oct 2, 2007",Rated T,13,1.0,"macOS, Linux, Xbox 360, PlayStation 3, PC","Aspyr Media, id Software, Nerve Software, Splash Damage, Underground Development",Activision Blizzard,"Quake II: Enhanced Edition, Quake Champions, Quake Live, Quake IV, Quake III Arena, Quake II, Quake II: Quad Damage, Quake","Multiplayer, Aliens, RTS, Robots, Tanks, LAN, helicopters, prequel, quad-bike",84,144,813,Shooter,https://rawg.io/games/enemy-territory-quake-wars,http://www.enemyterritory.com
WarHawk (2007),1583,"Action, Shooter, Arcade","Aug 28, 2007",Rated T,0,10.4,PlayStation 3,Incognito Entertainment,Sony Computer Entertainment,No,Not defined,84,1479,4594,Shooter,https://rawg.io/games/warhawk-2007,http://www.us.playstation.com/Warhawk/
The Binding of Isaac,1584,"Action, RPG, Indie","Sep 28, 2011",Not rated,0,5.0,"macOS, PC",Edmund McMillen and Florian Himsl,Edmund McMillen,The Binding of Isaac: Rebirth,"Singleplayer, Steam Achievements, Atmospheric, steam-trading-cards, Great Soundtrack, RPG, 2D, Difficult, Survival, Dark, Replay Value, Roguelike, Top-Down, Roguelite, Dungeon Crawler, Procedural Generation, Bullet Hell, Perma Death, Arena Shooter",84,10,48,Indie,https://rawg.io/games/the-binding-of-isaac,Not defined
NeverAwake,1585,"Action, Indie","Sep 28, 2022",Not rated,0,10.4,PC,Neotro,Phoenixx,No,"Singleplayer, Steam Achievements, Full controller support, Steam Cloud, Story Rich, Female Protagonist, Dark, Cute, Dark Fantasy, Side Scroller, Multiple Endings, Shoot 'Em Up, Dark Humor, Hand-drawn, Emotional, Twin Stick Shooter, Протагонистка, Score Attack, Abstract",84,1603,17648,Action,https://rawg.io/games/neverawake,https://neverawake.neotro.jp
Patrick's Parabox,1586,"Strategy, Casual, Indie, Puzzle","Mar 29, 2022",Not rated,0,3.0,"Linux, macOS, PC",Patrick Traynor,Patrick Traynor,No,"Singleplayer, Steam Achievements, Full controller support, Steam Cloud, 2D, Horror, Difficult, Minimalist, Abstract, Logic, Sokoban",84,287,672,Puzzle,https://rawg.io/games/patricks-parabox,https://www.patricksparabox.com/
Lost in Play,1587,"Adventure, Casual, Indie","Aug 10, 2022",Rated E10+,0,2.0,"PC, Nintendo Switch",Happy Juice Games,Joystick Ventures,No,"Singleplayer, Steam Achievements, Full controller support, Steam Cloud, Atmospheric, Story Rich, Fantasy, Funny, Female Protagonist, Comedy, Point & Click, Family Friendly, Cute, Mystery, Colorful, Surreal, Hand-drawn, Cartoon, Протагонистка, wholesome",84,149,1187,Casual,https://rawg.io/games/lost-in-play,https://www.happyjuice.games/
Mediterranea Inferno,1588,Adventure,"Aug 24, 2023",Not rated,0,2.0,"macOS, PC","Eyeguys, Lorenzo Redaelli",Santa Ragione,No,"Singleplayer, Steam Achievements, Full controller support, Story Rich, Horror, Dark, Anime, Choices Matter, Colorful, Multiple Endings, Visual Novel, Surreal, Drama, Hand-drawn, Comic Book, Romance, Choose Your Own Adventure, Emotional, Psychological, Thriller, LGBTQ+, Psychedelic, Романтика",84,248,6065,Adventure,https://rawg.io/games/mediterranea-inferno,https://www.mediterraneainferno.com
FIFA 14,1589,Sports,"Sep 24, 2013",Rated E,0,35.0,"Android, PS Vita, PlayStation 4, PSP, PlayStation 3, PlayStation 2, Xbox 360, Wii, Nintendo 3DS, Nintendo Switch, PC, iOS, Xbox One",Electronic Arts Canada,Electronic Arts,"FIFA 23, FIFA 22, FIFA 21, FIFA 20, FIFA 19, FIFA 18, FIFA Mobile, FIFA 17, EA SPORTS FIFA 16, FIFA 15, FIFA 13, FIFA 12, FIFA 11, FIFA 10, FIFA 09, FIFA 08, FIFA 07, FIFA 06, FIFA Football 2005, FIFA Football 2004, FIFA Football 2003, FIFA 2002, FIFA 2001, FIFA 2000, FIFA '99, FIFA: Road to World Cup 98, FIFA 97, FIFA Soccer 96, FIFA International Soccer, FIFA Soccer '95","3D, online, Mod, Football, Soccer, reality-based, ai",84,98,33,Sports,https://rawg.io/games/fifa-14,https://www.easports.com/fifa
New Super Mario Bros. U,1590,"Adventure, Platformer","Nov 18, 2012",Rated E,0,48.0,Wii U,Nintendo,Nintendo,"Super Mario Odyssey, Super Mario Run, Super Mario 3D World, New Super Mario Bros. 2, Super Mario 3D Land, Super Mario Galaxy 2, New Super Mario Bros. Wii, Super Mario Galaxy, New Super Mario Bros., Super Mario Sunshine, Super Mario World: Super Mario Advance 2, Super Mario 64, Super Mario World 2: Yoshi's Island, Super Mario World, Super Mario Bros. 3, Super Mario Bros. 2, Super Mario Bros.",Side-Scrolling,84,334,335,Platformer,https://rawg.io/games/new-super-mario-bros-u,http://newsupermariobrosu.nintendo.com/
Ultra Street Fighter IV,1591,"Action, Fighting","Jun 3, 2014",Rated T,13,4.0,"PlayStation 3, PC, Xbox 360, PlayStation 4","Capcom, Sony Computer Entertainment America",Capcom,No,"Singleplayer, Steam Achievements, Multiplayer, Full controller support, Steam Cloud, steam-trading-cards, Great Soundtrack, 2D, Difficult, Steam Leaderboards, Classic, Local Co-Op, Controller, Local Multiplayer, Anime, Competitive, Beat 'em up, 3D Vision, 2.5D, 2D Fighter, e-sports",84,107,26,Fighting,https://rawg.io/games/ultra-street-fighter-iv,http://www.streetfighter.com
Momodora: Moonlit Farewell,1592,"Action, Adventure, Indie","Jan 11, 2024",Not rated,0,1.0,PC,Bombservice,Playism,No,"Singleplayer, Steam Achievements, Full controller support, Steam Cloud, 2D, Fantasy, Exploration, Female Protagonist, Action-Adventure, Pixel Graphics, Retro, Anime, Nudity, combat, Magic, Sexual Content, Metroidvania, Steam Trading Cards, Протагонистка, 2D Platformer, 2D-платформер",84,259,9643,Adventure,https://rawg.io/games/momodora-moonlit-farewell,Not defined
Trine 2,1593,"Action, Arcade, Platformer","Dec 7, 2011",Rated E10+,10,3.0,"PC, Xbox 360, PlayStation 3","Frozenbyte, Atlus U.S.A, indieszero","Atlus, Atlus USA","Trine 4: The Nightmare Prince, Trine 3: The Artifacts of Power, Trine","Singleplayer, cooperative, puzzles",84,80,83,Arcade,https://rawg.io/games/trine-2,http://trine2.com
PixelJunk Monsters: Ultimate HD,1594,Strategy,"Jul 30, 2013",Rated E,0,4.0,"Linux, PC, macOS, PS Vita",Double Eleven,Double Eleven,"PixelJunk Monsters 2, PixelJunk Monsters Deluxe, PixelJunk Monsters","Singleplayer, Steam Achievements, Multiplayer, Full controller support, Steam Cloud, steam-trading-cards, Co-op, cooperative, 2D, Online Co-Op, Steam Leaderboards, Split Screen, Local Co-Op, Cross-Platform Multiplayer, controller support, Tower Defense",84,216,524,Strategy,https://rawg.io/games/pixeljunk-monsters-ultimate-hd,http://www.pixeljunkmonsters.com
Timespinner,1595,"Action, Adventure, RPG, Indie","Jun 4, 2019",Rated T,13,4.0,"Nintendo Switch, macOS, Linux, PlayStation 4, Xbox One, PS Vita, PC",Lunar Ray Games,"Chucklefish, Lunar Ray Games",No,"Singleplayer, Steam Achievements, Full controller support, RPG, Co-op, 2D, Female Protagonist, Pixel Graphics, role-playing, Metroidvania, LGBTQ+",84,323,1305,RPG,https://rawg.io/games/timespinner,http://www.timespinnergame.com
Telling Lies,1597,"Adventure, Simulation, Indie","Aug 23, 2019",Rated M,17,4.0,"PlayStation 4, Nintendo Switch, macOS, PC, iOS, Xbox One","Annapurna Interactive, Sam Barlow, Furious Bee",Annapurna Interactive,No,"Singleplayer, Steam Achievements, Full controller support, Steam Cloud, Story Rich, stats, Captions available, Mystery, Sexual Content, FMV",84,152,386,Simulation,https://rawg.io/games/telling-lies,Not defined
Zero Escape: Virtue's Last Reward,1598,"Adventure, Puzzle","Oct 23, 2012",Rated M,17,34.0,"Nintendo 3DS, PS Vita","Aksys Games, Chunsoft",Aksys Games,"Zero Escape: Zero Time Dilemma, 999: Nine Hours, Nine Persons, Nine Doors",puzzles,84,392,571,Puzzle,https://rawg.io/games/zero-escape-virtues-last-reward,http://virtueslastreward.com/
Hitman - Episode 2: Sapienza,1599,"Action, Shooter","Apr 26, 2016",Not rated,0,10.4,PC,IO Interactive,Square Enix,No,Not defined,84,4038,2029,Shooter,https://rawg.io/games/hitman-episode-2-sapienza,http://hitman.com/en-us
Swords & Soldiers,1600,Strategy,"Jun 8, 2009",Rated E10+,0,1.0,"Wii, PC, PlayStation 3, Wii U, Nintendo Switch","Two Tribes, Ronimo Games, Circle Entertainment, Ronimo","Two Tribes Publishing, Ronimo Games",No,"Multiplayer, Real time strategy",84,660,6184,Strategy,https://rawg.io/games/swords-and-soldiers,http://twotribes.com/message/swords-soldiers-hd-for-wii-u/
BioShock: The Collection,1601,"Action, Shooter","Sep 13, 2016",Rated M,17,10.4,"PlayStation 4, Nintendo Switch, PC, Xbox One","2K, Irrational Games, Virtuos","2K Games, Take Two Interactive",No,"First-Person, online, collection, interactive, bundle, infinite",84,156,329,Shooter,https://rawg.io/games/bioshock-the-collection,https://2k.com/en-US/game/bioshock-the-collection
Fuga: Melodies of Steel 2,1602,"RPG, Strategy, Simulation","May 11, 2023",Rated T,0,6.0,PC,CyberConnect2 Co.,CyberConnect2,No,"Singleplayer, Steam Achievements, Steam Cloud, Atmospheric, RPG, Story Rich, Partial Controller Support, Horror, Fantasy, War, Turn-Based, Cute, Turn-Based Strategy, JRPG, Drama, Turn-Based Combat, Turn-Based Tactics, Emotional, Tanks, Tactical RPG, Strategy RPG",84,779,5151,Simulation,https://rawg.io/games/fuga-melodies-of-steel-2,https://www.cc2.co.jp/fuga2/en/
